<?xml version="1.0"?>
<!DOCTYPE medas SYSTEM "concept.dtd">
<medas>
	<concepts modelPrefix="ewew">
		<concept>
			<prefLabels>
				<prefLabel default="true" lang="en">ewew</prefLabel>
			</prefLabels>
			<properties>
				<property name="ewew">
					<value>ewewe</value>
					<value>fff</value>
				</property>
			</properties>
		</concept>

	</concepts>
</medas>